{
  "body": {
    "country_code": "DE",
    "currency": "EUR",
    "elements": [
      {
        "price_components": [
          {
            "price": 2,
            "step_size": 300,
            "type": "TIME",
            "vat": 10
          }
        ]
      }
    ],
    "id": "12",
    "last_updated": "2024-05-31T00:00:00Z",
    "party_id": "ALL"
  },
  "headers": {
    "accept": "application/json"
  },
  "method": "PUT",
  "url": {
    "path": "/tariffs/{country_code}/{party_id}/{tariff_id}",
    "pathParams": {
      "country_code": "NL",
      "party_id": "TNM",
      "tariff_id": "12"
    }
  }
}
