{
  "body": {
    "address": "F.Rooseveltlaan 3B",
    "last_updated": "2015-06-29T20:39:09Z"
  },
  "headers": {
    "accept": "application/json"
  },
  "method": "PATCH",
  "url": {
    "path": "/locations/{country_code}/{party_id}/{location_id}",
    "pathParams": {
      "country_code": "NL",
      "location_id": "12",
      "party_id": "TNM"
    }
  }
}
