{
  "body": {
    "tariff_id": "15"
  },
  "headers": {
    "accept": "application/json"
  },
  "method": "PATCH",
  "url": {
    "path": "/locations/{country_code}/{party_id}/{location_id}/{evse_uid}/{connector_id}",
    "pathParams": {
      "connector_id": "1",
      "country_code": "NL",
      "evse_uid": "3256",
      "location_id": "12",
      "party_id": "TNM"
    }
  }
}
