{
  "body": {
    "amperage": 16,
    "format": "SOCKET",
    "id": "1",
    "last_updated": "2015-06-29T20:39:09Z",
    "power_type": "AC_3_PHASE",
    "standard": "IEC_62196_T2",
    "voltage": 220
  },
  "headers": {
    "accept": "application/json"
  },
  "method": "PUT",
  "url": {
    "path": "/locations/{country_code}/{party_id}/{location_id}/{evse_uid}/{connector_id}",
    "pathParams": {
      "connector_id": "1",
      "country_code": "NL",
      "evse_uid": "3257",
      "location_id": "12",
      "party_id": "TNM"
    }
  }
}
